{
  "id": "full_text",
  "title": "Full Text",
  "audience": "Readers studying or teaching the whole Standard Ebooks text.",
  "description": "Every reading unit in source order, with optional guide layers available but no abridgment.",
  "goals": [
    "Preserve the complete source text.",
    "Keep every abridged-path omission recoverable — nothing is deleted.",
    "Keep prefatory matter, chapters, epilogue, and source order visible."
  ],
  "scope": {
    "required_units": 142,
    "recommended_units": 0,
    "optional_units": 0,
    "summary_only_units": 0,
    "deferred_units": 0,
    "word_count_required": 210288
  },
  "unit_rules": [
    {
      "unit_id": "frontmatter-titlepage",
      "section_type": "frontmatter",
      "number": null,
      "title": "Moby Dick",
      "level": "required",
      "rationale": "The full-text path preserves every source reading unit in Standard Ebooks order."
    },
    {
      "unit_id": "frontmatter-imprint",
      "section_type": "frontmatter",
      "number": null,
      "title": "Imprint",
      "level": "required",
      "rationale": "The full-text path preserves every source reading unit in Standard Ebooks order."
    },
    {
      "unit_id": "frontmatter-dedication",
      "section_type": "frontmatter",
      "number": null,
      "title": "Dedication",
      "level": "required",
      "rationale": "The full-text path preserves every source reading unit in Standard Ebooks order."
    },
    {
      "unit_id": "frontmatter-etymology",
      "section_type": "frontmatter",
      "number": null,
      "title": "Etymology",
      "level": "required",
      "rationale": "The full-text path preserves every source reading unit in Standard Ebooks order."
    },
    {
      "unit_id": "frontmatter-extracts",
      "section_type": "frontmatter",
      "number": null,
      "title": "Extracts",
      "level": "required",
      "rationale": "The full-text path preserves every source reading unit in Standard Ebooks order."
    },
    {
      "unit_id": "frontmatter-halftitlepage",
      "section_type": "frontmatter",
      "number": null,
      "title": "Moby Dick",
      "level": "required",
      "rationale": "The full-text path preserves every source reading unit in Standard Ebooks order."
    },
    {
      "unit_id": "chapter-001-loomings",
      "section_type": "chapter",
      "number": 1,
      "title": "Loomings",
      "level": "required",
      "rationale": "The full-text path preserves every source reading unit in Standard Ebooks order."
    },
    {
      "unit_id": "chapter-002-the-carpetbag",
      "section_type": "chapter",
      "number": 2,
      "title": "The Carpetbag",
      "level": "required",
      "rationale": "The full-text path preserves every source reading unit in Standard Ebooks order."
    },
    {
      "unit_id": "chapter-003-the-spouter-inn",
      "section_type": "chapter",
      "number": 3,
      "title": "The Spouter-Inn",
      "level": "required",
      "rationale": "The full-text path preserves every source reading unit in Standard Ebooks order."
    },
    {
      "unit_id": "chapter-004-the-counterpane",
      "section_type": "chapter",
      "number": 4,
      "title": "The Counterpane",
      "level": "required",
      "rationale": "The full-text path preserves every source reading unit in Standard Ebooks order."
    },
    {
      "unit_id": "chapter-005-breakfast",
      "section_type": "chapter",
      "number": 5,
      "title": "Breakfast",
      "level": "required",
      "rationale": "The full-text path preserves every source reading unit in Standard Ebooks order."
    },
    {
      "unit_id": "chapter-006-the-street",
      "section_type": "chapter",
      "number": 6,
      "title": "The Street",
      "level": "required",
      "rationale": "The full-text path preserves every source reading unit in Standard Ebooks order."
    },
    {
      "unit_id": "chapter-007-the-chapel",
      "section_type": "chapter",
      "number": 7,
      "title": "The Chapel",
      "level": "required",
      "rationale": "The full-text path preserves every source reading unit in Standard Ebooks order."
    },
    {
      "unit_id": "chapter-008-the-pulpit",
      "section_type": "chapter",
      "number": 8,
      "title": "The Pulpit",
      "level": "required",
      "rationale": "The full-text path preserves every source reading unit in Standard Ebooks order."
    },
    {
      "unit_id": "chapter-009-the-sermon",
      "section_type": "chapter",
      "number": 9,
      "title": "The Sermon",
      "level": "required",
      "rationale": "The full-text path preserves every source reading unit in Standard Ebooks order."
    },
    {
      "unit_id": "chapter-010-a-bosom-friend",
      "section_type": "chapter",
      "number": 10,
      "title": "A Bosom Friend",
      "level": "required",
      "rationale": "The full-text path preserves every source reading unit in Standard Ebooks order."
    },
    {
      "unit_id": "chapter-011-nightgown",
      "section_type": "chapter",
      "number": 11,
      "title": "Nightgown",
      "level": "required",
      "rationale": "The full-text path preserves every source reading unit in Standard Ebooks order."
    },
    {
      "unit_id": "chapter-012-biographical",
      "section_type": "chapter",
      "number": 12,
      "title": "Biographical",
      "level": "required",
      "rationale": "The full-text path preserves every source reading unit in Standard Ebooks order."
    },
    {
      "unit_id": "chapter-013-wheelbarrow",
      "section_type": "chapter",
      "number": 13,
      "title": "Wheelbarrow",
      "level": "required",
      "rationale": "The full-text path preserves every source reading unit in Standard Ebooks order."
    },
    {
      "unit_id": "chapter-014-nantucket",
      "section_type": "chapter",
      "number": 14,
      "title": "Nantucket",
      "level": "required",
      "rationale": "The full-text path preserves every source reading unit in Standard Ebooks order."
    },
    {
      "unit_id": "chapter-015-chowder",
      "section_type": "chapter",
      "number": 15,
      "title": "Chowder",
      "level": "required",
      "rationale": "The full-text path preserves every source reading unit in Standard Ebooks order."
    },
    {
      "unit_id": "chapter-016-the-ship",
      "section_type": "chapter",
      "number": 16,
      "title": "The Ship",
      "level": "required",
      "rationale": "The full-text path preserves every source reading unit in Standard Ebooks order."
    },
    {
      "unit_id": "chapter-017-the-ramadan",
      "section_type": "chapter",
      "number": 17,
      "title": "The Ramadan",
      "level": "required",
      "rationale": "The full-text path preserves every source reading unit in Standard Ebooks order."
    },
    {
      "unit_id": "chapter-018-his-mark",
      "section_type": "chapter",
      "number": 18,
      "title": "His Mark",
      "level": "required",
      "rationale": "The full-text path preserves every source reading unit in Standard Ebooks order."
    },
    {
      "unit_id": "chapter-019-the-prophet",
      "section_type": "chapter",
      "number": 19,
      "title": "The Prophet",
      "level": "required",
      "rationale": "The full-text path preserves every source reading unit in Standard Ebooks order."
    },
    {
      "unit_id": "chapter-020-all-astir",
      "section_type": "chapter",
      "number": 20,
      "title": "All Astir",
      "level": "required",
      "rationale": "The full-text path preserves every source reading unit in Standard Ebooks order."
    },
    {
      "unit_id": "chapter-021-going-aboard",
      "section_type": "chapter",
      "number": 21,
      "title": "Going Aboard",
      "level": "required",
      "rationale": "The full-text path preserves every source reading unit in Standard Ebooks order."
    },
    {
      "unit_id": "chapter-022-merry-christmas",
      "section_type": "chapter",
      "number": 22,
      "title": "Merry Christmas",
      "level": "required",
      "rationale": "The full-text path preserves every source reading unit in Standard Ebooks order."
    },
    {
      "unit_id": "chapter-023-the-lee-shore",
      "section_type": "chapter",
      "number": 23,
      "title": "The Lee Shore",
      "level": "required",
      "rationale": "The full-text path preserves every source reading unit in Standard Ebooks order."
    },
    {
      "unit_id": "chapter-024-the-advocate",
      "section_type": "chapter",
      "number": 24,
      "title": "The Advocate",
      "level": "required",
      "rationale": "The full-text path preserves every source reading unit in Standard Ebooks order."
    },
    {
      "unit_id": "chapter-025-postscript",
      "section_type": "chapter",
      "number": 25,
      "title": "Postscript",
      "level": "required",
      "rationale": "The full-text path preserves every source reading unit in Standard Ebooks order."
    },
    {
      "unit_id": "chapter-026-knights-and-squires",
      "section_type": "chapter",
      "number": 26,
      "title": "Knights and Squires",
      "level": "required",
      "rationale": "The full-text path preserves every source reading unit in Standard Ebooks order."
    },
    {
      "unit_id": "chapter-027-knights-and-squires",
      "section_type": "chapter",
      "number": 27,
      "title": "Knights and Squires",
      "level": "required",
      "rationale": "The full-text path preserves every source reading unit in Standard Ebooks order."
    },
    {
      "unit_id": "chapter-028-ahab",
      "section_type": "chapter",
      "number": 28,
      "title": "Ahab",
      "level": "required",
      "rationale": "The full-text path preserves every source reading unit in Standard Ebooks order."
    },
    {
      "unit_id": "chapter-029-enter-ahab-to-him-stubb",
      "section_type": "chapter",
      "number": 29,
      "title": "Enter Ahab; To Him, Stubb",
      "level": "required",